{
  "$schema": "hoverpocket://schemas/capability-descriptor/v1",
  "id": "controls.volume.get",
  "version": 1,
  "titleKey": "capability.controls.volume.get",
  "effect": "private_read",
  "permissions": ["controls.read"],
  "approvalPolicy": "permission_grant",
  "idempotency": "optional",
  "availability": {"macos": "available", "windows": "available"},
  "limits": {"timeoutMs": 3000, "maxPayloadBytes": 4096, "maxCallsPerMinute": 120},
  "inputSchema": {"type": "object", "required": [], "properties": {}, "additionalProperties": false},
  "outputSchema": {
    "type": "object",
    "required": ["level", "muted"],
    "properties": {"level": {"type": "number", "minimum": 0, "maximum": 1}, "muted": {"type": "boolean"}},
    "additionalProperties": false
  },
  "readback": {"strategy": "same_store_snapshot", "match": ["level", "muted"]}
}
