{
  "$schema": "hoverpocket://schemas/capability-descriptor/v1",
  "id": "sticky.note.get",
  "version": 2,
  "titleKey": "capability.sticky.note.get",
  "effect": "private_read",
  "permissions": [
    "sticky.read"
  ],
  "approvalPolicy": "permission_grant",
  "idempotency": "optional",
  "availability": {
    "macos": "available",
    "windows": "unavailable"
  },
  "limits": {
    "timeoutMs": 3000,
    "maxPayloadBytes": 4096,
    "maxCallsPerMinute": 120
  },
  "inputSchema": {
    "type": "object",
    "required": [
      "noteId"
    ],
    "properties": {
      "noteId": {
        "type": "string",
        "maxLength": 128
      }
    },
    "additionalProperties": false
  },
  "outputSchema": {
    "type": "object",
    "required": [
      "noteId",
      "title",
      "body",
      "updatedAt",
      "reminder"
    ],
    "properties": {
      "noteId": {
        "type": "string",
        "maxLength": 128
      },
      "title": {
        "type": "string",
        "maxLength": 120
      },
      "body": {
        "type": "string",
        "maxLength": 10000
      },
      "updatedAt": {
        "type": "string",
        "format": "date-time"
      },
      "reminder": {
        "type": [
          "object",
          "null"
        ],
        "required": [
          "scheduledAt",
          "timeZone",
          "acknowledgedAt"
        ],
        "properties": {
          "scheduledAt": {
            "type": "string",
            "format": "date-time",
            "maxLength": 64,
            "pattern": "^\\d{4}-\\d{2}-\\d{2}T\\d{2}:\\d{2}:\\d{2}(?:\\.\\d{1,3})?(?:Z|[+-]\\d{2}:\\d{2})$"
          },
          "timeZone": {
            "type": "string",
            "minLength": 1,
            "maxLength": 128
          },
          "acknowledgedAt": {
            "type": [
              "string",
              "null"
            ],
            "format": "date-time"
          }
        },
        "additionalProperties": false
      }
    },
    "additionalProperties": false
  },
  "readback": {
    "strategy": "same_store_snapshot",
    "match": [
      "noteId",
      "updatedAt",
      "reminder"
    ]
  }
}
