{
  "$schema": "hoverpocket://schemas/capability-descriptor/v1",
  "id": "controls.availability.get",
  "version": 1,
  "titleKey": "capability.controls.availability.get",
  "effect": "private_read",
  "permissions": ["controls.read"],
  "approvalPolicy": "permission_grant",
  "idempotency": "optional",
  "availability": {"macos": "available", "windows": "available"},
  "limits": {"timeoutMs": 3000, "maxPayloadBytes": 4096, "maxCallsPerMinute": 120},
  "inputSchema": {"type": "object", "required": [], "properties": {}, "additionalProperties": false},
  "outputSchema": {
    "type": "object",
    "required": ["volumeAvailable", "brightnessAvailable", "mediaAvailable", "displayIds"],
    "properties": {
      "volumeAvailable": {"type": "boolean"},
      "brightnessAvailable": {"type": "boolean"},
      "mediaAvailable": {"type": "boolean"},
      "displayIds": {"type": "array", "maxItems": 16, "items": {"type": "string", "minLength": 1, "maxLength": 128}}
    },
    "additionalProperties": false
  },
  "readback": {"strategy": "same_store_snapshot", "match": ["volumeAvailable", "brightnessAvailable", "mediaAvailable", "displayIds"]}
}
